id,name,lat,lon,type, fuel,region,country,status,capacities,capacity_power,prod_kw,emfpm10, pm10_t_yr,emfpm25,pm25_t_yr,emfso2,so2_t_yr,emfnox,nox_t_yr,source
CN-1,Gboko Cement power station,7.411,8.974,,coal,Benue,Nigeria,operating,38.5,38,,,,,,,,,,GEM
CN-2,Ibese Cement power station,7.004,3.048,,coal,Ogun,Nigeria,operating,"37,37,37",111,,,,,,,,,,GEM
CN-3,Okpella Cement power station,7.344217,6.462388,,coal,Edo,Nigeria,operating,"30,30",60,,,,,,,,,,GEM
CN-4,Obajana Cement power station,7.926,6.423,,coal,Kogi,Nigeria,operating,"45,45,45",135,,,,,,,,,,GEM
CN-5,Ugboba power station,6.421924,6.460065,,lignite,Delta,Nigeria,permitted,600,600,,,,,,,,,,GEM
CN-6,Egbin Thermal Power Station,6.5661818,3.5946767,,,,Nigeria,,,,,,,,,,,,,
CN-7,NIPP Gbarain-Ubie Power Station,5.0310479,6.3015074,,,,Nigeria,,,,,,,,,,,,,
CN-8,Azura Edo IPP,6.4110031,5.6803898,,,,Nigeria,,,,,,,,,,,,,
CN-9,Egbema Power Plant Umuezi Mmahu,5.5656073,6.738329,,,,Nigeria,,,,,,,,,,,,,
CN-10,Oji Termal Station,6.2622331,7.2770691,,,,Nigeria,,,,,,,,,,,,,
CN-11,MOSRA ENERGY LTD,7.6750691,7.6900815,,,,Nigeria,,,,,,,,,,,,,
CN-12,Okoloma Gas Plant,4.8444578,7.2534579,,,,Nigeria,,,,,,,,,,,,,
CN-13,National Integrated Power Project,6.5859319,3.5231689,,,,Nigeria,,,,,,,,,,,,,
CN-14,Shiroro Power Station,9.9731206,6.8343434,,,,Nigeria,,,,,,,,,,,,,
CN-15,African Natural Resources & Mines Limited,9.4624814,7.3679633,,,,Nigeria,,,,,,,,,,,,,
CN-16,Ethiope Energy Ltd,4.8248095,7.0389116,,,,Nigeria,,,,,,,,,,,,,
CN-17,Resident Cement Gwana power station,9.630984,10.818145,,unknown,Bauchi,Nigeria,announced,100,100,,,,,,,,,,GEM
CN-18,DANGOTE BENUE CEMENT,7.4108,8.9739,,,,Nigeria,operating,43.9,43.9,,,,,,,,,,Climate Trace
CU-1,Mubuku I Hydroelectric Power Station,0.3183067,30.1003841,,,,Uganda,,,,,,,,,,,,,
CU-2,Mpanga Power Station,0.0664008,30.3213429,,,,Uganda,,,,,,,,,,,,,
CU-3,Bugoye Hydroelectric Power Station,0.30536,30.0979116,,,,Uganda,,,,,,,,,,,,,
CU-4,Nkusi Hydroelectric Power Station,1.1204641,30.6686338,,,,Uganda,,,,,,,,,,,,,
CU-5,Mubuku III Hydroelectric Power Station,0.260349,30.1493637,,,,Uganda,,,,,,,,,,,,,
CU-6,Nyagak Hydro Power Station,2.4282002,30.9733178,,,,Uganda,,,,,,,,,,,,,
CU-7,Mahoma Hydroelectric Power Station,0.4785387,30.2730483,,,,Uganda,,,,,,,,,,,,,
CU-8,Nkonge Solar Power Station,0.5761443,31.7195459,,,,Uganda,,,,,,,,,,,,,
CU-9,Uganda Electricity Generation Company Limited,0.3446615,32.5937724,,,,Uganda,,,,,,,,,,,,,
CU-10,Kabulasoke Solar Power Station,0.162181,31.80291,,,,Uganda,,,,,,,,,,,,,
CU-11,Kisiizi Hydroelectric Power Station,-0.9957926,29.9618406,,,,Uganda,,,,,,,,,,,,,
CU-12,Namugoga Solar Power Station,0.1725165,32.5681871,,,,Uganda,,,,,,,,,,,,,
CU-13,Osukuru Thermal Power Station,0.6321157,34.1583296,,,,Uganda,,,,,,,,,,,,,
CU-14,Tororo Thermal Power Station,0.6372205,34.1166619,,,,Uganda,,,,,,,,,,,,,
CU-15,Kiira Power Station,0.4502929,33.185576,,,,Uganda,,,,,,,,,,,,,
CU-16,Lugazi Thermal Power Station,0.3798548,32.9450197,,,,Uganda,,,,,,,,,,,,,
CU-17,Nyamagasani I Hydroelectric Power Station,0.141548,29.931688,,,,Uganda,,,,,,,,,,,,,
CU-18,Sindila Hydroelectric Power Station,0.6851763,30.0202964,,,,Uganda,,,,,,,,,,,,,
CU-19,Kakira Thermal Power Station,0.5089174,33.2899691,,,,Uganda,,,,,,,,,,,,,
CU-20,Ndugutu Hydroelectric Plant,0.6156281,29.9794407,,,,Uganda,,,,,,,,,,,,,
CG-1,Sunon-Asogli Power Limited,5.6788484,0.0467972,,,,Ghana,,,,,,,,,,,,,
CG-2,Kpone Thermal Power Station,5.7360445,0.0090934,,,,Ghana,,,,,,,,,,,,,
CG-3,Tema Thermal 1 Power Plant (TT1PP),5.6747055,0.011861,,,,Ghana,,,,,,,,,,,,,
CG-4,Amandi Energy power plant,4.9687311,-1.6664434,,,,Ghana,,,,,,,,,,,,,
CG-5,Cenpower Generation Company Limited,5.6808455,0.0405072,,,,Ghana,,,,,,,,,,,,,
CG-6,Kaleo Solar Power Plant,10.1744488,-2.5343935,,,,Ghana,,,,,,,,,,,,,
CG-7,Kpone Independent Power Plant,5.6815315,0.0409771,,,,Ghana,,,,,,,,,,,,,
CG-8,Ameri Power Plant,4.9742907,-1.6595719,,,,Ghana,,,,,,,,,,,,,
CG-9,Navrongo Solar Power Station,10.8800555,-1.1025222,,,,Ghana,,,,,,,,,,,,,
CG-10,GPGC Power Plant,5.6980491,0.0229239,,,,Ghana,,,,,,,,,,,,,
CG-11,AKSA ENERGY GHANA,5.6942001,0.0249885,,,,Ghana,,,,,,,,,,,,,
CG-12,Epl Bridge power plant,5.6482659,0.0192137,,,,Ghana,,,,,,,,,,,,,
CG-13,Nuclear Power Ghana,5.6126157,-0.1808765,,,,Ghana,,,,,,,,,,,,,
CG-14,Bridge Power Project,5.6773749,0.0184963,,,,Ghana,,,,,,,,,,,,,
CG-15,Gomoa Onyaadze Solar Power Station,5.3460915,-0.7034052,,,,Ghana,,,,,,,,,,,,,
CG-16,Nzema Solar Power Station,5.0462465,-2.4376759,,,,Ghana,,,,,,,,,,,,,
CS-1,Gallen Cement power station,14.796229,-17.039687,,unknown,Dakar,Senegal,operating,30,,,,,,,,,,,GEM
CS-2,Sendou power station,14.686988,-17.213926,,unknown,Dakar,Senegal,operating,125,,,,,,,,,,,GEM
